{
  "benchmark_id": "cys_glucose_150C_Farmer1999",
  "source_doi": "10.1016/S0308-8146(98)00174-8",
  "precursors": {
    "L-Cysteine": {"concentration_mM": 10.0},
    "D-Glucose": {"concentration_mM": 10.0}
  },
  "conditions": {
    "temp_C": 150,
    "ph": 5.5,
    "water_activity": 0.95,
    "time_min": 60
  },
  "metadata": {
    "tier": "PRIMARY",
    "family": "free_aa_sugar_discrimination",
    "execution_path": "free_precursor",
    "notes": "Hexose discrimination benchmark for sulfur and pyrazine output."
  },
  "validation_contract": {
    "scale_thresholds": {
      "max_ratio": 1.25,
      "mean_abs_log10_error": 0.06
    }
  },
  "measured_volatiles": {
    "2-methyl-3-furanthiol": {"conc_ppb": 15, "uncertainty_pct": 30},
    "furfural": {"conc_ppb": 450, "uncertainty_pct": 20},
    "pyrazine": {"conc_ppb": 30, "uncertainty_pct": 25}
  }
}
